{
  "schemaVersion": 1,
  "sessionId": "nintendo-ags-101-ws2-capture-loopback-v1",
  "classification": "synthetic-loopback",
  "capturedAt": "2026-08-20T00:00:00Z",
  "specimen": {
    "consoleId": "synthetic-loopback",
    "boardId": "synthetic-loopback",
    "lcdLabel": "synthetic-loopback",
    "brightnessMode": "synthetic",
    "warmupSeconds": 0,
    "temperatureC": 25,
    "ambientIlluminanceLux": 0,
    "chargerConnected": null,
    "batteryVoltage": null,
    "panelHistory": "not applicable: deterministic synthetic capture"
  },
  "detector": {
    "manufacturer": "Retro Display Lab",
    "model": "deterministic waveform generator",
    "serial": "synthetic",
    "bandwidthHz": null,
    "linearityCalibration": "exact synthetic response",
    "positionPixels": [
      119.5,
      79.5
    ],
    "footprintPixels": [
      16,
      16
    ]
  },
  "acquisition": {
    "sampleRateHz": 2000,
    "pretriggerSeconds": 0.02,
    "timeUnits": "s",
    "responseUnits": "V",
    "triggerThreshold": 0.5
  },
  "stimulus": {
    "suiteId": "nintendo-ags-101-ws2-stimulus-v1",
    "manifestSha256": "5475091cf9c67bc2082e569f52552745beb11359c08db0f91874c289acba2747"
  },
  "transitions": [
    {
      "transitionId": "accepted-clean-r0",
      "sceneId": "gtg-red-gate",
      "channel": "r",
      "fromCode": 0,
      "toCode": 31,
      "repetition": 0,
      "row": 79,
      "frameParity": 0,
      "eventReference": "source-frame-edge",
      "rawFile": "raw/accepted-clean-r0.csv",
      "sha256": "64a808c1c8cfa6a82f114a6ba00a3313a78711714f5f1c38ec9ea565cf301792",
      "fromPlateau": 0,
      "toPlateau": 1,
      "triggerUncertaintySeconds": 0.0005
    },
    {
      "transitionId": "accepted-clean-r1",
      "sceneId": "gtg-red-gate",
      "channel": "r",
      "fromCode": 0,
      "toCode": 31,
      "repetition": 1,
      "row": 79,
      "frameParity": 1,
      "eventReference": "source-frame-edge",
      "rawFile": "raw/accepted-clean-r1.csv",
      "sha256": "15b4f7207f59010dfd79dfef378786ca64980782a37ac6482d55e15e0839b2f4",
      "fromPlateau": 0,
      "toPlateau": 1,
      "triggerUncertaintySeconds": 0.0005
    },
    {
      "transitionId": "accepted-clean-r2",
      "sceneId": "gtg-red-gate",
      "channel": "r",
      "fromCode": 0,
      "toCode": 31,
      "repetition": 2,
      "row": 79,
      "frameParity": 0,
      "eventReference": "source-frame-edge",
      "rawFile": "raw/accepted-clean-r2.csv",
      "sha256": "88e2c851f7e34607e51bc6b3845070d44d457a32c89c8f0d035a0dd9b53d84ab",
      "fromPlateau": 0,
      "toPlateau": 1,
      "triggerUncertaintySeconds": 0.0005
    },
    {
      "transitionId": "rejected-noisy-r0",
      "sceneId": "gtg-green-gate",
      "channel": "g",
      "fromCode": 0,
      "toCode": 31,
      "repetition": 0,
      "row": 79,
      "frameParity": 0,
      "eventReference": "source-frame-edge",
      "rawFile": "raw/rejected-noisy-r0.csv",
      "sha256": "e7fb4478b0a738b7e329ffed6aa79339972db298c3c215f57ec589f5de025b1b",
      "fromPlateau": 0,
      "toPlateau": 1,
      "triggerUncertaintySeconds": 0.0005
    },
    {
      "transitionId": "rejected-noisy-r1",
      "sceneId": "gtg-green-gate",
      "channel": "g",
      "fromCode": 0,
      "toCode": 31,
      "repetition": 1,
      "row": 79,
      "frameParity": 1,
      "eventReference": "source-frame-edge",
      "rawFile": "raw/rejected-noisy-r1.csv",
      "sha256": "46617695a55aeed29911e6038a4db683069d89e6a778b61918db39ddf13c9ed6",
      "fromPlateau": 0,
      "toPlateau": 1,
      "triggerUncertaintySeconds": 0.0005
    },
    {
      "transitionId": "rejected-noisy-r2",
      "sceneId": "gtg-green-gate",
      "channel": "g",
      "fromCode": 0,
      "toCode": 31,
      "repetition": 2,
      "row": 79,
      "frameParity": 0,
      "eventReference": "source-frame-edge",
      "rawFile": "raw/rejected-noisy-r2.csv",
      "sha256": "ef892b01115104aed7f5d9c15c570c6bb629d99cd0a1740a623451560ebf3944",
      "fromPlateau": 0,
      "toPlateau": 1,
      "triggerUncertaintySeconds": 0.0005
    },
    {
      "transitionId": "rejected-overshoot-r0",
      "sceneId": "gtg-blue-gate",
      "channel": "b",
      "fromCode": 0,
      "toCode": 31,
      "repetition": 0,
      "row": 79,
      "frameParity": 0,
      "eventReference": "source-frame-edge",
      "rawFile": "raw/rejected-overshoot-r0.csv",
      "sha256": "59a6eacceb9c555a61036cde2c9e7049e9810241b8c0d39684d0a6d33d37fcb0",
      "fromPlateau": 0,
      "toPlateau": 1,
      "triggerUncertaintySeconds": 0.0005
    },
    {
      "transitionId": "rejected-overshoot-r1",
      "sceneId": "gtg-blue-gate",
      "channel": "b",
      "fromCode": 0,
      "toCode": 31,
      "repetition": 1,
      "row": 79,
      "frameParity": 1,
      "eventReference": "source-frame-edge",
      "rawFile": "raw/rejected-overshoot-r1.csv",
      "sha256": "6716600402bec168dfed51f9c75919c58739692f1cc31894393a23638a960ef2",
      "fromPlateau": 0,
      "toPlateau": 1,
      "triggerUncertaintySeconds": 0.0005
    },
    {
      "transitionId": "rejected-overshoot-r2",
      "sceneId": "gtg-blue-gate",
      "channel": "b",
      "fromCode": 0,
      "toCode": 31,
      "repetition": 2,
      "row": 79,
      "frameParity": 0,
      "eventReference": "source-frame-edge",
      "rawFile": "raw/rejected-overshoot-r2.csv",
      "sha256": "505eac23a510d35842fa7689417681e468a1b6124fb321a23ff05075e94d0549",
      "fromPlateau": 0,
      "toPlateau": 1,
      "triggerUncertaintySeconds": 0.0005
    },
    {
      "transitionId": "rejected-missing-r0",
      "sceneId": "gtg-red-gate",
      "channel": "r",
      "fromCode": 8,
      "toCode": 24,
      "repetition": 0,
      "row": 79,
      "frameParity": 0,
      "eventReference": "source-frame-edge",
      "rawFile": "raw/rejected-missing-r0.csv",
      "sha256": "d07563a94a6a0578e90869ed816ec2b8818542020bdb6d7ba022dfc086ffffa7",
      "fromPlateau": 0,
      "toPlateau": 1,
      "triggerUncertaintySeconds": 0.0005
    },
    {
      "transitionId": "rejected-missing-r1",
      "sceneId": "gtg-red-gate",
      "channel": "r",
      "fromCode": 8,
      "toCode": 24,
      "repetition": 1,
      "row": 79,
      "frameParity": 1,
      "eventReference": "source-frame-edge",
      "rawFile": "raw/rejected-missing-r1.csv",
      "sha256": "fe2727384b666f930e96ae3ce473560e61de00a00171d6d780f6ce26efe6150a",
      "fromPlateau": 0,
      "toPlateau": 1,
      "triggerUncertaintySeconds": 0.0005
    },
    {
      "transitionId": "rejected-missing-r2",
      "sceneId": "gtg-red-gate",
      "channel": "r",
      "fromCode": 8,
      "toCode": 24,
      "repetition": 2,
      "row": 79,
      "frameParity": 0,
      "eventReference": "source-frame-edge",
      "rawFile": "raw/rejected-missing-r2.csv",
      "sha256": "c02c29438a341aee340f606fab5d755fbf861f7584ccaca5d3fb58d6925ef968",
      "fromPlateau": 0,
      "toPlateau": 1,
      "triggerUncertaintySeconds": 0.0005
    },
    {
      "transitionId": "rejected-censored-r0",
      "sceneId": "gtg-green-gate",
      "channel": "g",
      "fromCode": 4,
      "toCode": 27,
      "repetition": 0,
      "row": 79,
      "frameParity": 0,
      "eventReference": "source-frame-edge",
      "rawFile": "raw/rejected-censored-r0.csv",
      "sha256": "84c25b52937d9c0cbf7365f49e05e2e95c2fe2b48259056b44ff98c1eac66dcb",
      "fromPlateau": 0,
      "toPlateau": 1,
      "triggerUncertaintySeconds": 0.0005
    },
    {
      "transitionId": "rejected-censored-r1",
      "sceneId": "gtg-green-gate",
      "channel": "g",
      "fromCode": 4,
      "toCode": 27,
      "repetition": 1,
      "row": 79,
      "frameParity": 1,
      "eventReference": "source-frame-edge",
      "rawFile": "raw/rejected-censored-r1.csv",
      "sha256": "8c7fb4778663646a7794e4be4ab6de9e8b76b32a103403a8fc8eb383f619b7f3",
      "fromPlateau": 0,
      "toPlateau": 1,
      "triggerUncertaintySeconds": 0.0005
    },
    {
      "transitionId": "rejected-censored-r2",
      "sceneId": "gtg-green-gate",
      "channel": "g",
      "fromCode": 4,
      "toCode": 27,
      "repetition": 2,
      "row": 79,
      "frameParity": 0,
      "eventReference": "source-frame-edge",
      "rawFile": "raw/rejected-censored-r2.csv",
      "sha256": "82d8252308aecf8b2948563d9f7270e28279cf2b116db6ec43f2425d75126ff8",
      "fromPlateau": 0,
      "toPlateau": 1,
      "triggerUncertaintySeconds": 0.0005
    }
  ],
  "notes": "Synthetic only: exercises alignment, repetitions, noise, overshoot, missing samples, censored settling, and fit rejection."
}
